{"verdict":"NOT_CLEAN","coverage":[{"atom_id":"A1","status":"COVERED"},{"atom_id":"A2","status":"COVERED"},{"atom_id":"A3","status":"NOT_COVERED"},{"atom_id":"A4","status":"COVERED"},{"atom_id":"A5","status":"NOT_COVERED"}],"findings":[{"atom_id":"A3","scope":null,"file_location":"reports/quality/global-memory-comparison-evidence-2026-08-28.md:116","impact":"The Markdown report and committed progress receipt classify independent review as NOT_RUN, while the JSON manifest records ROUND_1_NOT_CLEAN and four schema-valid NOT_CLEAN review artifacts are committed. This understates an observed failed review round and makes the report/JSON verification status inconsistent.","minimal_fix":"Update the Markdown report and progress receipt to record ROUND_1_NOT_CLEAN, identify the four committed review results, and state that corrections await re-review."},{"atom_id":"A5","scope":null,"file_location":".agents/progress/session-utterance-01a0439f-82d0-7613-bd98-8d2365cc6a06.json:54","impact":"The durable issue/Discord receipt binds the report and manifest as published at commit 7a9999f, with hashes b58ec3... and 1fc8c2..., but both artifacts were subsequently corrected in bc560f4 and now hash to 391a4f... and c53d11.... There is no committed evidence that the corrected HEAD artifacts were added to the GitHub issue or delivered to Luke, so delivery does not cover the current report identity.","minimal_fix":"Update the GitHub issue and resend the corrected HEAD report and manifest, then commit a receipt containing their current commit, byte counts, SHA-256 hashes, issue-comment identifier, and Discord message identifier."}],"frame_assessment":{"scope_is_sufficient":true,"missing_concerns":[]},"runtime_observed":false}