{"verdict":"NOT_CLEAN","coverage":[{"atom_id":"A1","status":"COVERED"},{"atom_id":"A2","status":"COVERED"},{"atom_id":"A3","status":"NOT_COVERED"},{"atom_id":"A4","status":"COVERED"},{"atom_id":"A5","status":"NOT_COVERED"}],"findings":[{"atom_id":"A3","scope":null,"file_location":"reports/quality/global-memory-comparison-evidence-2026-08-28.md:116","impact":"The Markdown says all independent structured-review attempts were NOT_RUN because of infrastructure/schema failures, while the adjacent JSON records ROUND_1_NOT_CLEAN and four committed schema-valid Codex reviews contain substantive findings. This makes the adversarial-review status internally inconsistent and incorrectly erases an observed failed review round.","minimal_fix":"Update the Markdown and progress receipt to record ROUND_1_NOT_CLEAN and the four committed reviews, reserving NOT_RUN only for the separate failed provider attempts; synchronize the JSON reason accordingly."},{"atom_id":"A5","scope":null,"file_location":".agents/progress/session-utterance-01a0439f-82d0-7613-bd98-8d2365cc6a06.json:52","impact":"The durable GitHub/Discord receipt binds the original 7a9999f report and manifest hashes, but both artifacts were materially corrected afterward and current HEAD hashes differ. Therefore the receipt does not establish delivery of the current reviewed report/manifest identity.","minimal_fix":"Post and DM the corrected HEAD artifacts, then append a new immutable receipt containing their commit, byte counts, SHA-256 values, GitHub comment identifier, and Discord message identifier while preserving the historical receipt."}],"frame_assessment":{"scope_is_sufficient":true,"missing_concerns":[]},"runtime_observed":false}