{"verdict":"NOT_CLEAN","coverage":[{"atom_id":"A1","status":"COVERED"},{"atom_id":"A2","status":"COVERED"},{"atom_id":"A3","status":"NOT_COVERED"},{"atom_id":"A4","status":"COVERED"},{"atom_id":"A5","status":"NOT_COVERED"}],"findings":[{"atom_id":"A3","scope":null,"file_location":".agents/progress/session-utterance-01a0439f-82d0-7613-bd98-8d2365cc6a06.json:50","impact":"The durable progress receipt still records independent structured review as NOT_RUN, while four committed round-one reviews returned NOT_CLEAN and the manifest records ROUND_1_NOT_CLEAN. The Markdown report likewise describes only the earlier unavailable-review attempts. Review state is therefore inconsistent across the checkpoint artifacts.","minimal_fix":"Record both states explicitly and consistently: earlier unavailable attempts were NOT_RUN, followed by four round-one NOT_CLEAN reviews; update the progress receipt and Markdown report to match the JSON manifest."},{"atom_id":"A5","scope":null,"file_location":".agents/progress/session-utterance-01a0439f-82d0-7613-bd98-8d2365cc6a06.json:54","impact":"The publication commit and Discord attachment hashes bind the pre-correction artifacts from commit 7a9999f, not the current corrected report and manifest. Current hashes are 391a4f0aad7aaf0c371de53c6da5cf2df3a4c6f0ff430f789cd4ccc5d9508a4b and c53d116badb819792c2943cf4741a68a07def1a4866aecb0f6e8b9c70862b21a, which differ from the recorded delivered hashes. Thus there is no durable evidence that Luke or the GitHub issue received the actual reviewed artifacts at HEAD.","minimal_fix":"Publish the corrected checkpoint, update issue #40, resend the current Markdown and JSON to Luke, and commit the new publication commit, issue-comment identifier, message identifier, sizes, and matching SHA-256 hashes."}],"frame_assessment":{"scope_is_sufficient":true,"missing_concerns":[]},"runtime_observed":false}