{"verdict":"NOT_CLEAN","coverage":[{"atom_id":"A1","status":"COVERED"},{"atom_id":"A2","status":"COVERED"},{"atom_id":"A3","status":"NOT_COVERED"},{"atom_id":"A4","status":"COVERED"},{"atom_id":"A5","status":"COVERED"}],"findings":[{"atom_id":"A3","scope":null,"file_location":"reports/quality/global-memory-comparison-evidence-2026-08-28.json:8","impact":"The checkpoint records PREFLIGHT_CLEAN while leaving complexitySha256 null and claiming its identity exists in a release receipt, but commit 1164723 contains no such receipt. The test/typecheck/build results are likewise only transcribed into prose/JSON. Consequently the deterministic verification state is not commit-bound evidence and cannot be independently checked from this checkpoint.","minimal_fix":"Commit a machine-readable release/verification receipt bound to commit 1164723 that contains the preflight complexity digest and command-result identities, then reference its path and hash from both report formats; otherwise downgrade these fields to unverified recorded claims and remove the nonexistent receipt assertion."}],"frame_assessment":{"scope_is_sufficient":true,"missing_concerns":[]},"runtime_observed":false}