{"verdict":"NOT_CLEAN","coverage":[{"atom_id":"A1","status":"COVERED"},{"atom_id":"A2","status":"COVERED"},{"atom_id":"A3","status":"NOT_COVERED"},{"atom_id":"A4","status":"COVERED"},{"atom_id":"A5","status":"NOT_COVERED"}],"findings":[{"atom_id":"A3","scope":null,"file_location":"reports/quality/global-memory-comparison-evidence-2026-08-28.md:116","impact":"The Markdown report and progress receipt classify independent review as NOT_RUN, while the JSON manifest and four committed schema-valid role reviews record ROUND_1_NOT_CLEAN. This makes the checkpoint's adversarial-review status internally inconsistent and understates recorded failures.","minimal_fix":"Change the Markdown report and progress receipt to ROUND_1_NOT_CLEAN, identify the four committed reviews, and retain re-review as an open gate."},{"atom_id":"A5","scope":null,"file_location":".agents/progress/session-utterance-01a0439f-82d0-7613-bd98-8d2365cc6a06.json:54","impact":"The GitHub/Discord delivery receipt binds commit 7a9999f and attachment hashes b58ec3bc/1fc8c2ba, but current HEAD changed both delivered artifacts to hashes 391a4f0a/c53d116b. Therefore the durable receipt proves delivery only of the superseded report and manifest, not the corrected current checkpoint.","minimal_fix":"Publish and deliver the corrected HEAD artifacts, then commit the new publication commit, issue-comment identifier, message identifier, byte counts, and SHA-256 hashes."}],"frame_assessment":{"scope_is_sufficient":true,"missing_concerns":[]},"runtime_observed":false}