{"verdict":"NOT_CLEAN","coverage":[{"atom_id":"A1","status":"COVERED"},{"atom_id":"A2","status":"COVERED"},{"atom_id":"A3","status":"NOT_COVERED"},{"atom_id":"A4","status":"COVERED"},{"atom_id":"A5","status":"COVERED"}],"findings":[{"atom_id":"A3","scope":null,"file_location":".agents/progress/session-utterance-01a0439f-82d0-7613-bd98-8d2365cc6a06.json:9","impact":"The progress receipt lists preregistration as a cleared gate even though the corrected residual-batch record explicitly says its thresholds and observations were committed together and are not preregistered. This promotes retrospective development evidence into a cleared validation gate and makes the status ledger internally false.","minimal_fix":"Remove preregistration from gates_cleared or rename it to an explicitly retrospective development-decision gate."},{"atom_id":"A3","scope":null,"file_location":"reports/quality/global-memory-comparison-evidence-2026-08-28.json:9","impact":"The manifest leaves complexitySha256 null while promising that the deterministic-preflight identity is in an immutable release receipt; the committed delivery receipt records artifact hashes and a publication commit but no preflight complexity hash. Consequently PREFLIGHT_CLEAN is not bound to the reviewed artifact identity as claimed.","minimal_fix":"Record the actual deterministic-preflight complexity SHA-256 in the manifest or immutable delivery receipt and update the corresponding identity-location statement."}],"frame_assessment":{"scope_is_sufficient":true,"missing_concerns":[]},"runtime_observed":false}