{"verdict":"NOT_CLEAN","coverage":[{"atom_id":"A1","status":"COVERED"},{"atom_id":"A2","status":"COVERED"},{"atom_id":"A3","status":"NOT_COVERED"},{"atom_id":"A4","status":"COVERED"},{"atom_id":"A5","status":"COVERED"}],"findings":[{"atom_id":"A3","scope":null,"file_location":"reports/quality/global-memory-comparison-evidence-2026-08-28.json:9","impact":"The manifest leaves complexitySha256 null and claims the deterministic-preflight identity is bound in the immutable release receipt, but commit 1164723's receipt contains no complexity digest. Thus PREFLIGHT_CLEAN is not bound to a reproducible final identity as reported.","minimal_fix":"Record the actual final preflight complexity SHA-256 in the committed release receipt and manifest, or explicitly state that the preflight identity was not retained and remains unverified."}],"frame_assessment":{"scope_is_sufficient":true,"missing_concerns":[]},"runtime_observed":false}